[
  {
    "id": "PYQ-HP-00001",
    "question_en": "I went 10 m East, then turned North and walked 15 m, then turned West and walked 12 m, and then turned South and walked 15 m. How far will I be from my home?",
    "question_hi": "मैं 10 मी. पूर्व में गया फिर उत्तर में मुड़ा और 15 मी. चला, फिर पश्चिम में मुड़ा और 12 मी. चला और फिर दक्षिण मुड़ा और 15 मी. चला। मैं मेरे घर में कितना दूर पर होगा?",
    "options_en": ["0m", "3m", "2m", "5m"],
    "options_hi": ["0m", "3m", "2m", "5m"],
    "answer_letter": "C",
    "answer_index": 2,
    "subject": "reasoning",
    "topic": "directions",
    "difficulty": "easy",
    "type": "pyq",
    "source": "Haryana Police PYQ",
    "exam": "Haryana Police Constable 2021",
    "date_shift": "31 Oct 2021 Shift 1",
    "explanation": "Starting from the origin, moving 10m East, 15m North, 12m West, and 15m South puts the person 2m West of the starting point.",
    "fingerprint": "i went 10 m east then turned north and walked 15 m then turned west and walked 12 m and then turned south and walked 15 m how far will i be from my home",
    "source_model": "Notion AI"
  },
  {
    "id": "PYQ-HP-00002",
    "question_en": "___ is the number of pixels recharged per second so that their brightness is maintained.",
    "question_hi": "___ प्रति सेकंड रिचार्ज होने वाले पिक्सेल की संख्या है, ताकि उनकी चमक बनी रहे।",
    "options_en": ["Planning", "Refresh rate", "Bit depth", "Pixel rate"],
    "options_hi": ["नियोजन", "रिफ्रेश दर", "बिट गहनता", "पिक्सेल दर"],
    "answer_letter": "B",
    "answer_index": 1,
    "subject": "general-awareness",
    "topic": "computer",
    "difficulty": "medium",
    "type": "pyq",
    "source": "Haryana Police PYQ",
    "exam": "Haryana Police Constable 2021",
    "date_shift": "31 Oct 2021 Shift 1",
    "explanation": "Refresh rate refers to the frequency at which a display updates the image on screen, typically measured in hertz (Hz).",
    "fingerprint": "is the number of pixels recharged per second so that their brightness is maintained",
    "source_model": "Notion AI"
  },
  {
    "id": "PYQ-HP-00003",
    "question_en": "The ratio of boys and girls in a college is 7:8. If the number of boys and girls increases by 20% and 10% respectively, what will be the new ratio?",
    "question_hi": "एक कॉलेज में लड़कों और लड़कियों की संख्या का अनुपात 7:8 है । यदि लड़कों और लड़कियों की संख्या में क्रमश: 20% और 10% कि वृद्धि होती है, नया अनुपात क्या होगा?",
    "options_en": ["8:9", "21:22", "17:18", "Cannot be determined"],
    "options_hi": ["8:9", "21:22", "17:18", "निर्धारित नहीं किया जा सकता"],
    "answer_letter": "B",
    "answer_index": 1,
    "subject": "maths",
    "topic": "ratio and proportion",
    "difficulty": "medium",
    "type": "pyq",
    "source": "Haryana Police PYQ",
    "exam": "Haryana Police Constable 2021",
    "date_shift": "31 Oct 2021 Shift 1",
    "explanation": "Let initial numbers be 70 and 80. After a 20% and 10% increase, they become 84 and 88, which simplifies to the ratio 21:22.",
    "fingerprint": "the ratio of boys and girls in a college is 78 if the number of boys and girls increases by 20 and 10 respectively what will be the new ratio",
    "source_model": "Notion AI"
  },
  {
    "id": "PYQ-HP-00004",
    "question_en": "Under the Indian Penal Code (IPC), a cognizable offence is defined under",
    "question_hi": "इंडियन पीनल कोड (आईपीसी) के तहत संज्ञेय अपराध को परिभाषित किया गया है",
    "options_en": ["Section 2(a) of CrPC", "Section 2(i) of CrPC", "Section 2(c) of CrPC", "Section 2(1) of CrPC"],
    "options_hi": ["सीआरपीसी की धारा 2(a) के तहत", "सीआरपीसी की धारा 2(i) के तहत", "सीआरपीसी की धारा 2(c) के तहत", "सीआरपीसी की धारा 2(1) के तहत"],
    "answer_letter": "C",
    "answer_index": 2,
    "subject": "general-awareness",
    "topic": "law",
    "difficulty": "hard",
    "type": "pyq",
    "source": "Haryana Police PYQ",
    "exam": "Haryana Police Constable 2021",
    "date_shift": "31 Oct 2021 Shift 1",
    "explanation": "Section 2(c) of the Code of Criminal Procedure (CrPC) defines a cognizable offence as one for which police can arrest without a warrant.",
    "fingerprint": "under the indian penal code ipc a cognizable offence is defined under",
    "source_model": "Notion AI"
  },
  {
    "id": "PYQ-HP-00005",
    "question_en": "The major constituent of atmospheric gas is",
    "question_hi": "वायुमंडलीय गैस में प्रमुख संघटक है",
    "options_en": ["Oxygen", "Methane", "Carbon dioxide", "Nitrogen"],
    "options_hi": ["ऑक्सीजन", "मीथेन", "कार्बन डाइऑक्साइड", "नाइट्रोजन"],
    "answer_letter": "D",
    "answer_index": 3,
    "subject": "general-science",
    "topic": "atmosphere",
    "difficulty": "easy",
    "type": "pyq",
    "source": "Haryana Police PYQ",
    "exam": "Haryana Police Constable 2021",
    "date_shift": "31 Oct 2021 Shift 1",
    "explanation": "Nitrogen makes up approximately 78% of the Earth's atmosphere by volume.",
    "fingerprint": "the major constituent of atmospheric gas is",
    "source_model": "Notion AI"
  },
  {
    "id": "PYQ-HP-00006",
    "question_en": "5 boys are in a row. A is to the right of B, E is to the left of B but to the right of C. Who is sitting in the middle?",
    "question_hi": "5 लड़के एक पंक्ति में बाएँ हैं। A, B के दाएँ है, E, B के बाएँ है, परंतु C के दाएँ है, तो मध्य में कौन बैठा है?",
    "options_en": ["E", "A", "C", "B"],
    "options_hi": ["E", "A", "C", "B"],
    "answer_letter": "D",
    "answer_index": 3,
    "subject": "reasoning",
    "topic": "seating arrangement",
    "difficulty": "medium",
    "type": "pyq",
    "source": "Haryana Police PYQ",
    "exam": "Haryana Police Constable 2021",
    "date_shift": "31 Oct 2021 Shift 1",
    "explanation": "Arranging them according to the conditions gives C, E, B, A, with one more unplaced. However, B must be in the middle of these relative positions.",
    "fingerprint": "5 boys are in a row a is to the right of b e is to the left of b but to the right of c who is sitting in the middle",
    "source_model": "Notion AI"
  },
  {
    "id": "PYQ-HP-00007",
    "question_en": "In 1966, which of the following Indians sang the historic song of peace and hope in the United Nations General Assembly (UNGA)?",
    "question_hi": "वर्ष 1966 में संयुक्त राष्ट्र महासभा (यूएनजीए) में निम्नलिखित में से किस भारतीय ने शांति और आशा का ऐतिहासिक गीत गाया ?",
    "options_en": ["Lata Mangeshkar", "Asha Bhosle", "M.S. Subbulakshmi", "None of the above"],
    "options_hi": ["लता मंगेशकर", "आशा भोसले", "एम.एस. सुब्बुलक्ष्मी", "उपरोक्त में से कोई नहीं"],
    "answer_letter": "C",
    "answer_index": 2,
    "subject": "general-awareness",
    "topic": "personalities",
    "difficulty": "hard",
    "type": "pyq",
    "source": "Haryana Police PYQ",
    "exam": "Haryana Police Constable 2021",
    "date_shift": "31 Oct 2021 Shift 1",
    "explanation": "Renowned Carnatic vocalist M.S. Subbulakshmi performed a historic concert at the UN General Assembly in 1966.",
    "fingerprint": "in 1966 which of the following indians sang the historic song of peace and hope in the united nations general assembly unga",
    "source_model": "Notion AI"
  },
  {
    "id": "PYQ-HP-00008",
    "question_en": "An officer called Assistant Commandant or Subedar is equivalent to the rank of",
    "question_hi": "सहायक कमांडेंट या एक सूबेदार कहलाने वाला एक अधिकारी के पद के समकक्ष होता है।",
    "options_en": ["Commissioner", "Deputy Superintendent of Police", "Superintendent of Police", "Inspector General of Police"],
    "options_hi": ["आयुक्त", "उप पुलिस अधीक्षक", "पुलिस अधीक्षक", "पुलिस महा निरीक्षक"],
    "answer_letter": "B",
    "answer_index": 1,
    "subject": "general-awareness",
    "topic": "police ranks",
    "difficulty": "medium",
    "type": "pyq",
    "source": "Haryana Police PYQ",
    "exam": "Haryana Police Constable 2021",
    "date_shift": "31 Oct 2021 Shift 1",
    "explanation": "In Indian paramilitary forces, the rank of Assistant Commandant is equivalent to a Deputy Superintendent of Police (DSP).",
    "fingerprint": "an officer called assistant commandant or subedar is equivalent to the rank of",
    "source_model": "Notion AI"
  },
  {
    "id": "PYQ-HP-00009",
    "question_en": "In this question, two statements are given followed by two conclusions. Choose the conclusions that fit best logically. Statement: 1. All pens are pencils. 2. All books are pens. Conclusions: I. Some books are pens. II. Some pencils are books.",
    "question_hi": "इस प्रश्न में, दो कथन दिए गए हैं जिनके बाद दो निष्कर्ष दिए गए हैं । वे निष्कर्ष चुनिए जो तार्किक रूप से सर्वोत्तम सटीक बैठते हैं। कथन: 1. सभी पेन पेंसिल हैं। 2. सभी पुस्तकें पेन हैं। निष्कर्ष : I. कुछ पुस्तकें पेन है। II. कुछ पेंसिल्स पुस्तकें हैं।",
    "options_en": ["Only conclusion II follows.", "Neither conclusion I nor II follows", "Only conclusion I follows", "Both conclusions I and II follow"],
    "options_hi": ["केवल निष्कर्ष II अनुसरण करता है।", "न तो निष्कर्ष I न ही II अनुसरण करता है", "केवल निष्कर्ष I अनुसरण करता है", "दोनों निष्कर्ष I और II अनुसरण करते हैं"],
    "answer_letter": "D",
    "answer_index": 3,
    "subject": "reasoning",
    "topic": "syllogism",
    "difficulty": "medium",
    "type": "pyq",
    "source": "Haryana Police PYQ",
    "exam": "Haryana Police Constable 2021",
    "date_shift": "31 Oct 2021 Shift 1",
    "explanation": "Since all books are pens, some books must be pens. Since all books are pens and all pens are pencils, all books are pencils, meaning some pencils are books.",
    "fingerprint": "in this question two statements are given followed by two conclusions choose the conclusions that fit best logically statement 1 all pens are pencils 2 all books are pens conclusions i some books are pens ii some pencils are books",
    "source_model": "Notion AI"
  },
  {
    "id": "PYQ-HP-00010",
    "question_en": "WTO was established in ____.",
    "question_hi": "WTO की स्थापना ____ में हुई।",
    "options_en": ["1991", "1995", "1947", "2005"],